,position,location,Recruiter,Ad_id,job_source,Details,text,n_tokens
1147,Live-Out Full Time Housekeeper,"Brixton, London",CHACE PEOPLE LIMITED,5412109609,gumtree,"LIVE OUT PERMANENT HOUSEKEEPER FOR VVIP FAMILY IN MAYFAIR - INTERVIEWS TAKING PLACE NOW!  Salary: £40,000k - £45,000 gross p.a. Location: Mayfair, London Interviews taking place now! Full-time | 5 days a week rotational schedule, 2 days off Permanent position  The Chace People team is actively searching for a brilliant Housekeeper to join a fully staffed household in Mayfair, London.  This is a fast-paced position where you will be joining a supportive team, with a Head Housekeeper, a Second Housekeeper and a House Manager already in place.  Ideally you will have superb Private Household experience and a clear understanding of how ultra-high net-worth households are run. Five-star hotel experience is much appreciated!  We are looking for a confident candidate with positive attitude who is highly detail oriented and with a great command of the English language. You shall be clear in your communication and will offer flexibility as required.  This is a full-time position where you will generally work 5 days a week, between 8-10h per day with Friday and Saturday as your usual days off, depending on the needs of the Principals.  You will be performing all usual Housekeeper duties one would expect of such a formal household, as well as intricate laundry care and ironing.  If this sounds like the right role for you, then please do get in touch, we'd love to hear from you!  Please note that candidates with relevant experience and excellent, checkable references need only apply."," Job Position:Live-Out Full Time Housekeeper; Recruiter Company: CHACE PEOPLE LIMITED; Job Location:Brixton, London; Job Description: LIVE OUT PERMANENT HOUSEKEEPER FOR VVIP FAMILY IN MAYFAIR - INTERVIEWS TAKING PLACE NOW! Salary: £40,000k - £45,000 gross p.a. Location: Mayfair, London Interviews taking place now! Full-time | 5 days a week rotational schedule, 2 days off Permanent position The Chace People team is actively searching for a brilliant Housekeeper to join a fully staffed household in Mayfair, London. This is a fast-paced position where you will be joining a supportive team, with a Head Housekeeper, a Second Housekeeper and a House Manager already in place. Ideally you will have superb Private Household experience and a clear understanding of how ultra-high net-worth households are run. Five-star hotel experience is much appreciated! We are looking for a confident candidate with positive attitude who is highly detail oriented and with a great command of the English language. You shall be clear in your communication and will offer flexibility as required. This is a full-time position where you will generally work 5 days a week, between 8-10h per day with Friday and Saturday as your usual days off, depending on the needs of the Principals. You will be performing all usual Housekeeper duties one would expect of such a formal household, as well as intricate laundry care and ironing. If this sounds like the right role for you, then please do get in touch, we'd love to hear from you! Please note that candidates with relevant experience and excellent, checkable references need only apply.Job Source:gumtree",359
1148,"Live In Carers Needed - Register With Us - Immediate Starts - Up To £1,150 Per Week","Bolton, Manchester",Live in Care Jobs Limited,5412038189,gumtree,"LIVE-IN CARERS URGENTLY NEEDED to join the UK's premier Live in Care Jobs site for free!  Established in 2008 we are now the UK’s largest Job Board for Live-in Carers. Due to growth and an increasing pool of vacancies, we are currently looking for experienced Carers to register with us.  It is completely free for you to register and with over 700 leading employers and private recruiters currently working with us to find their talent, most experienced candidates are placed into a new role within just a few hours of applying!  What are the benefits of registering with us?  We are a true specialist within live-in care roles, you will find work relevant to you Very quick and easy registration process Ability to apply for jobs as well as be found by recruiters Most of our applicants find work immediately We have placements throughout the UK Salaries range up to £1,150 per week!  If you are an experienced Carer looking for your next role and are interested in live-in care, please register using the link below today.  We welcome all registrations from experienced and qualified applicants eligible to live and work in the UK."," Job Position:Live In Carers Needed - Register With Us - Immediate Starts - Up To £1,150 Per Week; Recruiter Company: Live in Care Jobs Limited; Job Location:Bolton, Manchester; Job Description: LIVE-IN CARERS URGENTLY NEEDED to join the UK's premier Live in Care Jobs site for free! Established in 2008 we are now the UK’s largest Job Board for Live-in Carers. Due to growth and an increasing pool of vacancies, we are currently looking for experienced Carers to register with us. It is completely free for you to register and with over 700 leading employers and private recruiters currently working with us to find their talent, most experienced candidates are placed into a new role within just a few hours of applying! What are the benefits of registering with us? We are a true specialist within live-in care roles, you will find work relevant to you Very quick and easy registration process Ability to apply for jobs as well as be found by recruiters Most of our applicants find work immediately We have placements throughout the UK Salaries range up to £1,150 per week! If you are an experienced Carer looking for your next role and are interested in live-in care, please register using the link below today. We welcome all registrations from experienced and qualified applicants eligible to live and work in the UK.Job Source:gumtree",290
1149,Senior Front of House and Barista on a food truck,"Addlestone, Surrey",No recuriter details,5412038359,gumtree,"Senior Front of House and Barista on a food truck  £26,000 - £28,000   Benefits  Addlestone, Surrey  Embark on an exciting opportunity as a Senior Front of House and Barista, playing a crucial role within a vibrant team that caters to various events across Surrey and London. From corporate events and film shoots to dog shows, sporting events, and festivals, this position offers a dynamic environment for showcasing your skills with the flexibility of working hours tailored to meet client demands. If you possess a passion for hospitality and thrive in a fast-paced setting, seize this exceptional opportunity as a Senior Front of House and Barista.  Senior Front of House and Barista Ideal Profile:  Possess a valid and clean driving license (standard driving licence needed) and willing to drive the food truck Demonstrated proficiency in operating a professional coffee machine Acquired practical experience within the hospitality industry, with knowledge and skills in customer service Flexibility to work weekends, ensuring availability during peak periods and catering to the needs of the business Display a positive and customer-focused demeanour, consistently delivering exceptional service Possess a strong work ethic, exhibiting dedication and professionalism in all aspects of duties  Benefits:  Casual dress Company events Discounted or free food Employee discount  Senior Front of House and Barista Responsibilities:  Operate in Surrey and London areas, providing catering services for various events such as corporate events, film shoots, dog shows, sporting events, and festivals Ensure timely and efficient transportation of equipment and supplies to event locations Set up service stations and equipment, ensuring a well-organized and visually appealing setup Provide exceptional customer service by serving food and coffee to customers, catering to their specific needs and preferences Maintain cleanliness and hygiene standards throughout the service, including regular cleaning and sanitization of equipment, surfaces, and service areas"," Job Position:Senior Front of House and Barista on a food truck; Recruiter Company: No recuriter details; Job Location:Addlestone, Surrey; Job Description: Senior Front of House and Barista on a food truck £26,000 - £28,000 Benefits Addlestone, Surrey Embark on an exciting opportunity as a Senior Front of House and Barista, playing a crucial role within a vibrant team that caters to various events across Surrey and London. From corporate events and film shoots to dog shows, sporting events, and festivals, this position offers a dynamic environment for showcasing your skills with the flexibility of working hours tailored to meet client demands. If you possess a passion for hospitality and thrive in a fast-paced setting, seize this exceptional opportunity as a Senior Front of House and Barista. Senior Front of House and Barista Ideal Profile: Possess a valid and clean driving license (standard driving licence needed) and willing to drive the food truck Demonstrated proficiency in operating a professional coffee machine Acquired practical experience within the hospitality industry, with knowledge and skills in customer service Flexibility to work weekends, ensuring availability during peak periods and catering to the needs of the business Display a positive and customer-focused demeanour, consistently delivering exceptional service Possess a strong work ethic, exhibiting dedication and professionalism in all aspects of duties Benefits: Casual dress Company events Discounted or free food Employee discount Senior Front of House and Barista Responsibilities: Operate in Surrey and London areas, providing catering services for various events such as corporate events, film shoots, dog shows, sporting events, and festivals Ensure timely and efficient transportation of equipment and supplies to event locations Set up service stations and equipment, ensuring a well-organized and visually appealing setup Provide exceptional customer service by serving food and coffee to customers, catering to their specific needs and preferences Maintain cleanliness and hygiene standards throughout the service, including regular cleaning and sanitization of equipment, surfaces, and service areasJob Source:gumtree",406
1150,Multi Drop Driver,"Prescot, Merseyside",Advio,5412026713,gumtree,"Job Title: Parcel Delivery Driver  Location: PRESCOT  Job Type: Flexible, Part-time/Full-time  Salary: £20-£40 per hour (average pay)  We are currently seeking reliable and motivated individuals to join our team as Parcel Delivery Drivers. As a delivery driver, you will be responsible for delivering parcels to customers in your local area using your own car or van.  Key Responsibilities:  Collecting parcels from the depot and delivering them to customers' addresses Ensuring parcels are delivered on time and in good condition Providing excellent customer service Maintaining accurate records of deliveries made Ensuring that all parcels are delivered safely and securely  Requirements:  A full UK driving license and access to your own car/van Valid Insurance,MOT & Tax A smartphone with GPS capabilities Good communication skills and the ability to provide excellent customer service Flexibility to work on a part-time basis, with the ability to choose your own hours No previous experience required, training will be provided  Benefits:  Bi-weekly pay Pay for each item you deliver Competitive hourly rate, with highly achievable pay rates of £20-£40 per hour Flexible working hours, allowing you to choose when you want to work The ability to go straight home after completing your deliveries, with no need to return to the depot Excellent Work-Life balance  We Have work 7 days a week it's up to you to when you want to work, no commitments!  If you are interested in this exciting opportunity, please apply now via WhatsApp 07497 608 909 stating your full name,email address and area you wish to work."," Job Position:Multi Drop Driver; Recruiter Company: Advio; Job Location:Prescot, Merseyside; Job Description: Job Title: Parcel Delivery Driver Location: PRESCOT Job Type: Flexible, Part-time/Full-time Salary: £20-£40 per hour (average pay) We are currently seeking reliable and motivated individuals to join our team as Parcel Delivery Drivers. As a delivery driver, you will be responsible for delivering parcels to customers in your local area using your own car or van. Key Responsibilities: Collecting parcels from the depot and delivering them to customers' addresses Ensuring parcels are delivered on time and in good condition Providing excellent customer service Maintaining accurate records of deliveries made Ensuring that all parcels are delivered safely and securely Requirements: A full UK driving license and access to your own car/van Valid Insurance,MOT & Tax A smartphone with GPS capabilities Good communication skills and the ability to provide excellent customer service Flexibility to work on a part-time basis, with the ability to choose your own hours No previous experience required, training will be provided Benefits: Bi-weekly pay Pay for each item you deliver Competitive hourly rate, with highly achievable pay rates of £20-£40 per hour Flexible working hours, allowing you to choose when you want to work The ability to go straight home after completing your deliveries, with no need to return to the depot Excellent Work-Life balance We Have work 7 days a week it's up to you to when you want to work, no commitments! If you are interested in this exciting opportunity, please apply now via WhatsApp 07497 608 909 stating your full name,email address and area you wish to work.Job Source:gumtree",354
1151,Tree Surgeon,"Coventry, West Midlands",No recuriter details,5412126220,gumtree,"Arborists/Tree Surgeons and Team Leaders  Beechwood Trees and Landscapes Ltd are an Arb AC based in Coventry, due to the progression of the company we are looking for arborists to join our teams.  Applicants will need to have the following, although further training will be provided:  Industry experience (a minimum of 3 years climbing for team leaders) The ability to organise, motivate and run a crew.(Team Leader roles only) Industry qualifications, NPTC, First Aid, Chapter 8 etc. Driving licence (Pre 96 and B E desirable)  In return we will offer the successful applicant:  Excellent work environment and equipment resource Competitive rates of pay with 28 days holiday Additional days holiday for your birthday Full PPE and company uniform Further training and development plan  If you would like to apply for this position, please send us a CV to office@beechwoodtrees.co.uk or call 0800 3287988  Job Type: Full-time  Salary: £35,000.00-£42,792.34 per year  Schedule:  8 hour shift Day shift Monday to Friday  Supplemental pay types:  Bonus scheme  Ability to commute/relocate:  Coventry: reliably commute or plan to relocate before starting work"," Job Position:Tree Surgeon; Recruiter Company: No recuriter details; Job Location:Coventry, West Midlands; Job Description: Arborists/Tree Surgeons and Team Leaders Beechwood Trees and Landscapes Ltd are an Arb AC based in Coventry, due to the progression of the company we are looking for arborists to join our teams. Applicants will need to have the following, although further training will be provided: Industry experience (a minimum of 3 years climbing for team leaders) The ability to organise, motivate and run a crew.(Team Leader roles only) Industry qualifications, NPTC, First Aid, Chapter 8 etc. Driving licence (Pre 96 and B E desirable) In return we will offer the successful applicant: Excellent work environment and equipment resource Competitive rates of pay with 28 days holiday Additional days holiday for your birthday Full PPE and company uniform Further training and development plan If you would like to apply for this position, please send us a CV to office@beechwoodtrees.co.uk or call 0800 3287988 Job Type: Full-time Salary: £35,000.00-£42,792.34 per year Schedule: 8 hour shift Day shift Monday to Friday Supplemental pay types: Bonus scheme Ability to commute/relocate: Coventry: reliably commute or plan to relocate before starting workJob Source:gumtree",284
1152,Part Time Live In Carer,"Altrincham, Manchester",No recuriter details,5412108160,gumtree,"Part time live in Carer required - 2 consecutive days per week to care for gentleman aged 95. Duties involve:  Moving & Handling - experience of banana board preferable  All personal care, medication & meals  Self employed - NO AGENCIES  References required.  Pay - dependent on experience at competitive rates £150  per day  Face to face interview essential  Local to Altrincham, Cheshire preferred  NO SPONSORSHIPS"," Job Position:Part Time Live In Carer; Recruiter Company: No recuriter details; Job Location:Altrincham, Manchester; Job Description: Part time live in Carer required - 2 consecutive days per week to care for gentleman aged 95. Duties involve: Moving & Handling - experience of banana board preferable All personal care, medication & meals Self employed - NO AGENCIES References required. Pay - dependent on experience at competitive rates £150 per day Face to face interview essential Local to Altrincham, Cheshire preferred NO SPONSORSHIPSJob Source:gumtree",123
1153,Full time / Part time Cleaner / Housekeeper at 4 stars friendly guesthouse on Leith Walk,Edinburgh,No recuriter details,5412116070,gumtree,"We are looking for reliable cleaners / housekeepers to join our friendly guesthouse on Leith walk.  The guesthouse is a family run 4 stars guesthouse with 9 bedrooms to provide guests a pleasant stay.  Work starts from 10:00 to 11:00 in the morning.  We offer  part time 12 to 24 hours a week £12-15/hour depends on experience full time from 30 hours, salary package is negotiable and guaranteed year round paid holidays referral bonus recognition, incentives and awards friendly working environment  Experience preferred but not essential. Immediate start and flexible start date will be offered to right candidates.  If you would like to join our team, please send CV to matthew@fraochouse.co.uk or call 07444058776 to arrange interview."," Job Position:Full time / Part time Cleaner / Housekeeper at 4 stars friendly guesthouse on Leith Walk; Recruiter Company: No recuriter details; Job Location:Edinburgh; Job Description: We are looking for reliable cleaners / housekeepers to join our friendly guesthouse on Leith walk. The guesthouse is a family run 4 stars guesthouse with 9 bedrooms to provide guests a pleasant stay. Work starts from 10:00 to 11:00 in the morning. We offer part time 12 to 24 hours a week £12-15/hour depends on experience full time from 30 hours, salary package is negotiable and guaranteed year round paid holidays referral bonus recognition, incentives and awards friendly working environment Experience preferred but not essential. Immediate start and flexible start date will be offered to right candidates. If you would like to join our team, please send CV to matthew@fraochouse.co.uk or call 07444058776 to arrange interview.Job Source:gumtree",207
1154,Telesales,"Westcliff-on-Sea, Essex",No recuriter details,5412125713,gumtree,Part time telesales  Working at our offices in Westcliff on Sea or can work from home.  Flexible hours daytime or evening  Selling advertising space around display Maps in towns across the South East of England.  Booking appointments for field sales reps.  A minimum of a year's telesales experience required.  Full training provided.," Job Position:Telesales; Recruiter Company: No recuriter details; Job Location:Westcliff-on-Sea, Essex; Job Description: Part time telesales Working at our offices in Westcliff on Sea or can work from home. Flexible hours daytime or evening Selling advertising space around display Maps in towns across the South East of England. Booking appointments for field sales reps. A minimum of a year's telesales experience required. Full training provided.Job Source:gumtree",106
1155,Labourer,"Beckenham, London",No recuriter details,5412112640,gumtree,"Labourer needed for jobs in London, outer London and surrounding kent areas. Role would be general labouring and assisting tradesmen. Mainly extensions and building garden rooms is what we do so if interested please contact."," Job Position:Labourer; Recruiter Company: No recuriter details; Job Location:Beckenham, London; Job Description: Labourer needed for jobs in London, outer London and surrounding kent areas. Role would be general labouring and assisting tradesmen. Mainly extensions and building garden rooms is what we do so if interested please contact.Job Source:gumtree",81
1156,Part-time Gardener,"Auchterarder, Perth and Kinross",No recuriter details,5412118962,gumtree,"Part-Time Gardener Wanted for Linden Park, Auchterarder  We are seeking a skilled and experienced part-time gardener to help maintain the beautiful grounds of Linden Park, a private property in Auchterarder, Scotland. The ideal candidate will have a strong passion for gardening and a keen eye for detail. This is a fantastic opportunity for someone who enjoys working outdoors and takes pride in their work.  Responsibilities:  - Regular maintenance of the garden, including lawn mowing, weeding, pruning, and planting  - Monitoring and maintaining the health of plants, trees, and shrubs  - Applying fertilizers, pesticides, and other necessary treatments as needed  - Maintaining garden tools and equipment  - Installing and maintaining irrigation systems  - Collaborating with the property owner on garden design and landscaping projects  - Ensuring the garden remains visually appealing and tidy at all times  - Adhering to health and safety regulations  Requirements:  - Previous experience in gardening or landscaping, with knowledge of horticulture and plant care  - Strong attention to detail and the ability to work independently  - Good physical fitness and the ability to perform manual labor tasks  - Knowledge of safe and effective use of gardening tools and equipment  - A reliable and flexible approach to work, with the ability to adapt to changing priorities  - Driving license and access to own transportation (preferred)  To apply, please submit your CV along with a cover letter detailing your relevant experience. We kindly ask for applicants to provide at least two references.  We look forward to hearing from you!"," Job Position:Part-time Gardener; Recruiter Company: No recuriter details; Job Location:Auchterarder, Perth and Kinross; Job Description: Part-Time Gardener Wanted for Linden Park, Auchterarder We are seeking a skilled and experienced part-time gardener to help maintain the beautiful grounds of Linden Park, a private property in Auchterarder, Scotland. The ideal candidate will have a strong passion for gardening and a keen eye for detail. This is a fantastic opportunity for someone who enjoys working outdoors and takes pride in their work. Responsibilities: - Regular maintenance of the garden, including lawn mowing, weeding, pruning, and planting - Monitoring and maintaining the health of plants, trees, and shrubs - Applying fertilizers, pesticides, and other necessary treatments as needed - Maintaining garden tools and equipment - Installing and maintaining irrigation systems - Collaborating with the property owner on garden design and landscaping projects - Ensuring the garden remains visually appealing and tidy at all times - Adhering to health and safety regulations Requirements: - Previous experience in gardening or landscaping, with knowledge of horticulture and plant care - Strong attention to detail and the ability to work independently - Good physical fitness and the ability to perform manual labor tasks - Knowledge of safe and effective use of gardening tools and equipment - A reliable and flexible approach to work, with the ability to adapt to changing priorities - Driving license and access to own transportation (preferred) To apply, please submit your CV along with a cover letter detailing your relevant experience. We kindly ask for applicants to provide at least two references. We look forward to hearing from you!Job Source:gumtree",352
