,position,location,Recruiter,Ad_id,job_source,Details,text,n_tokens
1104,"Live In Carers Needed - Register With Us - Immediate Starts - Up To £1,150 Per Week","Hull, East Yorkshire",Live in Care Jobs Limited,5412038200,gumtree,"LIVE-IN CARERS URGENTLY NEEDED to join the UK's premier Live in Care Jobs site for free!  Established in 2008 we are now the UK’s largest Job Board for Live-in Carers. Due to growth and an increasing pool of vacancies, we are currently looking for experienced Carers to register with us.  It is completely free for you to register and with over 700 leading employers and private recruiters currently working with us to find their talent, most experienced candidates are placed into a new role within just a few hours of applying!  What are the benefits of registering with us?  We are a true specialist within live-in care roles, you will find work relevant to you Very quick and easy registration process Ability to apply for jobs as well as be found by recruiters Most of our applicants find work immediately We have placements throughout the UK Salaries range up to £1,150 per week!  If you are an experienced Carer looking for your next role and are interested in live-in care, please register using the link below today.  We welcome all registrations from experienced and qualified applicants eligible to live and work in the UK."," Job Position:Live In Carers Needed - Register With Us - Immediate Starts - Up To £1,150 Per Week; Recruiter Company: Live in Care Jobs Limited; Job Location:Hull, East Yorkshire; Job Description: LIVE-IN CARERS URGENTLY NEEDED to join the UK's premier Live in Care Jobs site for free! Established in 2008 we are now the UK’s largest Job Board for Live-in Carers. Due to growth and an increasing pool of vacancies, we are currently looking for experienced Carers to register with us. It is completely free for you to register and with over 700 leading employers and private recruiters currently working with us to find their talent, most experienced candidates are placed into a new role within just a few hours of applying! What are the benefits of registering with us? We are a true specialist within live-in care roles, you will find work relevant to you Very quick and easy registration process Ability to apply for jobs as well as be found by recruiters Most of our applicants find work immediately We have placements throughout the UK Salaries range up to £1,150 per week! If you are an experienced Carer looking for your next role and are interested in live-in care, please register using the link below today. We welcome all registrations from experienced and qualified applicants eligible to live and work in the UK.Job Source:gumtree",290
1105,Senior Front of House and Barista on a food truck,"Addlestone, Surrey",No recuriter details,5412038359,gumtree,"Senior Front of House and Barista on a food truck  £26,000 - £28,000   Benefits  Addlestone, Surrey  Embark on an exciting opportunity as a Senior Front of House and Barista, playing a crucial role within a vibrant team that caters to various events across Surrey and London. From corporate events and film shoots to dog shows, sporting events, and festivals, this position offers a dynamic environment for showcasing your skills with the flexibility of working hours tailored to meet client demands. If you possess a passion for hospitality and thrive in a fast-paced setting, seize this exceptional opportunity as a Senior Front of House and Barista.  Senior Front of House and Barista Ideal Profile:  Possess a valid and clean driving license (standard driving licence needed) and willing to drive the food truck Demonstrated proficiency in operating a professional coffee machine Acquired practical experience within the hospitality industry, with knowledge and skills in customer service Flexibility to work weekends, ensuring availability during peak periods and catering to the needs of the business Display a positive and customer-focused demeanour, consistently delivering exceptional service Possess a strong work ethic, exhibiting dedication and professionalism in all aspects of duties  Benefits:  Casual dress Company events Discounted or free food Employee discount  Senior Front of House and Barista Responsibilities:  Operate in Surrey and London areas, providing catering services for various events such as corporate events, film shoots, dog shows, sporting events, and festivals Ensure timely and efficient transportation of equipment and supplies to event locations Set up service stations and equipment, ensuring a well-organized and visually appealing setup Provide exceptional customer service by serving food and coffee to customers, catering to their specific needs and preferences Maintain cleanliness and hygiene standards throughout the service, including regular cleaning and sanitization of equipment, surfaces, and service areas"," Job Position:Senior Front of House and Barista on a food truck; Recruiter Company: No recuriter details; Job Location:Addlestone, Surrey; Job Description: Senior Front of House and Barista on a food truck £26,000 - £28,000 Benefits Addlestone, Surrey Embark on an exciting opportunity as a Senior Front of House and Barista, playing a crucial role within a vibrant team that caters to various events across Surrey and London. From corporate events and film shoots to dog shows, sporting events, and festivals, this position offers a dynamic environment for showcasing your skills with the flexibility of working hours tailored to meet client demands. If you possess a passion for hospitality and thrive in a fast-paced setting, seize this exceptional opportunity as a Senior Front of House and Barista. Senior Front of House and Barista Ideal Profile: Possess a valid and clean driving license (standard driving licence needed) and willing to drive the food truck Demonstrated proficiency in operating a professional coffee machine Acquired practical experience within the hospitality industry, with knowledge and skills in customer service Flexibility to work weekends, ensuring availability during peak periods and catering to the needs of the business Display a positive and customer-focused demeanour, consistently delivering exceptional service Possess a strong work ethic, exhibiting dedication and professionalism in all aspects of duties Benefits: Casual dress Company events Discounted or free food Employee discount Senior Front of House and Barista Responsibilities: Operate in Surrey and London areas, providing catering services for various events such as corporate events, film shoots, dog shows, sporting events, and festivals Ensure timely and efficient transportation of equipment and supplies to event locations Set up service stations and equipment, ensuring a well-organized and visually appealing setup Provide exceptional customer service by serving food and coffee to customers, catering to their specific needs and preferences Maintain cleanliness and hygiene standards throughout the service, including regular cleaning and sanitization of equipment, surfaces, and service areasJob Source:gumtree",406
1106,"Live In Carers Needed - Register With Us - Immediate Starts - Up To £1,150 Per Week","Wolverhampton, West Midlands",Live in Care Jobs Limited,5412038188,gumtree,"LIVE-IN CARERS URGENTLY NEEDED to join the UK's premier Live in Care Jobs site for free!  Established in 2008 we are now the UK’s largest Job Board for Live-in Carers. Due to growth and an increasing pool of vacancies, we are currently looking for experienced Carers to register with us.  It is completely free for you to register and with over 700 leading employers and private recruiters currently working with us to find their talent, most experienced candidates are placed into a new role within just a few hours of applying!  What are the benefits of registering with us?  We are a true specialist within live-in care roles, you will find work relevant to you Very quick and easy registration process Ability to apply for jobs as well as be found by recruiters Most of our applicants find work immediately We have placements throughout the UK Salaries range up to £1,150 per week!  If you are an experienced Carer looking for your next role and are interested in live-in care, please register using the link below today.  We welcome all registrations from experienced and qualified applicants eligible to live and work in the UK."," Job Position:Live In Carers Needed - Register With Us - Immediate Starts - Up To £1,150 Per Week; Recruiter Company: Live in Care Jobs Limited; Job Location:Wolverhampton, West Midlands; Job Description: LIVE-IN CARERS URGENTLY NEEDED to join the UK's premier Live in Care Jobs site for free! Established in 2008 we are now the UK’s largest Job Board for Live-in Carers. Due to growth and an increasing pool of vacancies, we are currently looking for experienced Carers to register with us. It is completely free for you to register and with over 700 leading employers and private recruiters currently working with us to find their talent, most experienced candidates are placed into a new role within just a few hours of applying! What are the benefits of registering with us? We are a true specialist within live-in care roles, you will find work relevant to you Very quick and easy registration process Ability to apply for jobs as well as be found by recruiters Most of our applicants find work immediately We have placements throughout the UK Salaries range up to £1,150 per week! If you are an experienced Carer looking for your next role and are interested in live-in care, please register using the link below today. We welcome all registrations from experienced and qualified applicants eligible to live and work in the UK.Job Source:gumtree",292
1107,Housekeeper,"Notting Hill, London",CHACE PEOPLE LIMITED,5412101961,gumtree,"LIVE-OUT HOUSEKEEPER POSITION FOR PROFESSIONAL HIGH-NET WORTH FAMILY IN MARYLEBONE  £45,000 - £50,000  gross p.a. (DOE) Marylebone, London Interviewing now! Live Out | Easy transport links or local candidates desired Approx. 45-50h per week with flexibility | Monday to Friday working week  The Chace People team is searching for a highly organised Housekeeper, who will bring a wealth of private household experience, for a lovely, young professional family of four living in Marylebone, London.  This is a 5-storey Georgian Townhouse with an existing household team in place consisting a Family PA and Nanny who you will be working alongside. As the ideal candidate you will be experienced and confident as a Sole Housekeeper, bringing nutritious family cooking skills, a child friendly attitude, 5* standards and an attention to detail mind-set with you.  Your duties will include (but not limited to):  All high-level housekeeping, cleaning and organisation of the home Laundry for the entire family, including ironing, care of fine fabrics and dry-cleaning errands Wardrobe maintenance and knowledge of dealing with delicate materials Packing and unpacking when the family travels Making a list of groceries and other household supplies that are required and which need replenishing; provisioning online and through errands Cooking family meals (simple, nutritious family dishes and following recipes) Receiving deliveries and running errands when needed Liaising with the household team and outside contractors to ensure the smooth running of the property Any other household tasks which are assigned to you - TBD at interview stage    As the ideal Housekeeper you will:  Have previous experience of working as a Sole Housekeeper in a large, busy private family household Have high levels of organisation and experience working unsupervised Understand professional boundaries and be respectful of privacy Be fast on your feet, with a positive energy and able to prioritise your tasks Value discretion with a friendly personality and be a team player  If this sounds like the right role for you, then please do get in touch, we'd love to hear from you and our client is interviewing now!  Please note that candidates with relevant experience and excellent, checkable references need only apply."," Job Position:Housekeeper; Recruiter Company: CHACE PEOPLE LIMITED; Job Location:Notting Hill, London; Job Description: LIVE-OUT HOUSEKEEPER POSITION FOR PROFESSIONAL HIGH-NET WORTH FAMILY IN MARYLEBONE £45,000 - £50,000 gross p.a. (DOE) Marylebone, London Interviewing now! Live Out | Easy transport links or local candidates desired Approx. 45-50h per week with flexibility | Monday to Friday working week The Chace People team is searching for a highly organised Housekeeper, who will bring a wealth of private household experience, for a lovely, young professional family of four living in Marylebone, London. This is a 5-storey Georgian Townhouse with an existing household team in place consisting a Family PA and Nanny who you will be working alongside. As the ideal candidate you will be experienced and confident as a Sole Housekeeper, bringing nutritious family cooking skills, a child friendly attitude, 5* standards and an attention to detail mind-set with you. Your duties will include (but not limited to): All high-level housekeeping, cleaning and organisation of the home Laundry for the entire family, including ironing, care of fine fabrics and dry-cleaning errands Wardrobe maintenance and knowledge of dealing with delicate materials Packing and unpacking when the family travels Making a list of groceries and other household supplies that are required and which need replenishing; provisioning online and through errands Cooking family meals (simple, nutritious family dishes and following recipes) Receiving deliveries and running errands when needed Liaising with the household team and outside contractors to ensure the smooth running of the property Any other household tasks which are assigned to you - TBD at interview stage As the ideal Housekeeper you will: Have previous experience of working as a Sole Housekeeper in a large, busy private family household Have high levels of organisation and experience working unsupervised Understand professional boundaries and be respectful of privacy Be fast on your feet, with a positive energy and able to prioritise your tasks Value discretion with a friendly personality and be a team player If this sounds like the right role for you, then please do get in touch, we'd love to hear from you and our client is interviewing now! Please note that candidates with relevant experience and excellent, checkable references need only apply.Job Source:gumtree",492
1108,AVON REPS-FULL OR PART TIME -IMMEDIATE START -ALL AREAS OF UK - WORK FROM HOME,"Brighton, East Sussex",Avon cosmetics,5412033401,gumtree,"AVON REPS WANTED  Work from home around your current commitments  Perfect for stay-at-home mums and dads, students, or you in your spare time.  ** IMMEDIATE START **  No experience required  AVON REPRESENTATIVES  work from home sharing your digital link to products to get orders, and earn commission from the sales.  share digital brochure links to find customers online. using facebook and Instagram, whatsapp, etc.  Customers can shop online with you, and pay for their shopping online and Avon delivers the orders for you and you earn from those orders.  OR  Share brochures with friends and family to get orders.  Deliver door-to-door to find more customers  Sell on eBay or Amazon and other selling sites if you want to earn more  MORE SALES = MORE EARNINGS  TEAM LEADERS are required throughout the UK.  Recruit and train a team of representatives, whilst earning commissions and bonuses on your team sales  Work from home around your existing commitments, Full or Part Time  Full training given for both positions  Must be 18  and living in the UK  COMMISSION ONLY JOB  APPLY NOW FOR MORE INFO"," Job Position:AVON REPS-FULL OR PART TIME -IMMEDIATE START -ALL AREAS OF UK - WORK FROM HOME; Recruiter Company: Avon cosmetics; Job Location:Brighton, East Sussex; Job Description: AVON REPS WANTED Work from home around your current commitments Perfect for stay-at-home mums and dads, students, or you in your spare time. ** IMMEDIATE START ** No experience required AVON REPRESENTATIVES work from home sharing your digital link to products to get orders, and earn commission from the sales. share digital brochure links to find customers online. using facebook and Instagram, whatsapp, etc. Customers can shop online with you, and pay for their shopping online and Avon delivers the orders for you and you earn from those orders. OR Share brochures with friends and family to get orders. Deliver door-to-door to find more customers Sell on eBay or Amazon and other selling sites if you want to earn more MORE SALES = MORE EARNINGS TEAM LEADERS are required throughout the UK. Recruit and train a team of representatives, whilst earning commissions and bonuses on your team sales Work from home around your existing commitments, Full or Part Time Full training given for both positions Must be 18 and living in the UK COMMISSION ONLY JOB APPLY NOW FOR MORE INFOJob Source:gumtree",287
1109,MONOBLOCKERS - IMMEDIATE START - £700-£1000 Weekly,"Motherwell, North Lanarkshire",No recuriter details,5412107554,gumtree,Experienced Mono blockers required for long term contracts in and around central Scotland area - with immediate start - Earn £700-£1000 per week directly into your bank account. Only experienced blockers need apply - VAN PROVIDED AFTER TRAINING PERIOD - Telephone 03330 503390," Job Position:MONOBLOCKERS - IMMEDIATE START - £700-£1000 Weekly; Recruiter Company: No recuriter details; Job Location:Motherwell, North Lanarkshire; Job Description: Experienced Mono blockers required for long term contracts in and around central Scotland area - with immediate start - Earn £700-£1000 per week directly into your bank account. Only experienced blockers need apply - VAN PROVIDED AFTER TRAINING PERIOD - Telephone 03330 503390Job Source:gumtree",113
1110,Daily Permanent Housekeeper,"Kensington, London",CHACE PEOPLE LIMITED,5412109796,gumtree,"FULL-TIME PERMANENT HOUSEKEEPER FOR VVIP FAMILY IN BELGRAVIA - INTERVIEWS TAKING PLACE NOW!  Salary: £42,000k - £45,000 gross p.a. Belgravia, London Interviews taking place now! Full-time | 5 days a week rotational schedule, 2 days off Permanent position  The Chace People team is actively searching for a brilliant Housekeeper to join a fully staffed household in Belgravia, London.  This is a fast-paced position where you will be joining a supportive team, with a Head Housekeeper, a Second Housekeeper and a House Manager already in place.  Ideally you will have superb Private Household experience and a clear understanding of how ultra-high net worth households are run. Five-star hotel experience is much appreciated!  We are looking for a confident candidate with positive attitude who is highly detail oriented and with a great command of the English language. You shall be clear in your communication and will offer flexibility as required.  This is a full-time position where your usual schedule when the Principals are not in the property would be as follows: Sunday - Monday from 9am-5pm, Tuesday - Thursday from 8am-3pm or 12pm-7pm (one week first shift, one week second shift), with Friday and Saturday as your days off. When the Principals are in the UK, the hours would be 10 hours a day, 6 days a week.  You will be performing all usual Housekeeper duties one would expect of such a formal household, as well as intricate laundry care and ironing.  If this sounds like the right role for you, then please do get in touch, we'd love to hear from you!  Please note that candidates with relevant experience and excellent, checkable references need only apply."," Job Position:Daily Permanent Housekeeper; Recruiter Company: CHACE PEOPLE LIMITED; Job Location:Kensington, London; Job Description: FULL-TIME PERMANENT HOUSEKEEPER FOR VVIP FAMILY IN BELGRAVIA - INTERVIEWS TAKING PLACE NOW! Salary: £42,000k - £45,000 gross p.a. Belgravia, London Interviews taking place now! Full-time | 5 days a week rotational schedule, 2 days off Permanent position The Chace People team is actively searching for a brilliant Housekeeper to join a fully staffed household in Belgravia, London. This is a fast-paced position where you will be joining a supportive team, with a Head Housekeeper, a Second Housekeeper and a House Manager already in place. Ideally you will have superb Private Household experience and a clear understanding of how ultra-high net worth households are run. Five-star hotel experience is much appreciated! We are looking for a confident candidate with positive attitude who is highly detail oriented and with a great command of the English language. You shall be clear in your communication and will offer flexibility as required. This is a full-time position where your usual schedule when the Principals are not in the property would be as follows: Sunday - Monday from 9am-5pm, Tuesday - Thursday from 8am-3pm or 12pm-7pm (one week first shift, one week second shift), with Friday and Saturday as your days off. When the Principals are in the UK, the hours would be 10 hours a day, 6 days a week. You will be performing all usual Housekeeper duties one would expect of such a formal household, as well as intricate laundry care and ironing. If this sounds like the right role for you, then please do get in touch, we'd love to hear from you! Please note that candidates with relevant experience and excellent, checkable references need only apply.Job Source:gumtree",409
