,position,location,Recruiter,Ad_id,job_source,Details,text,n_tokens
1049,"Associate Dentist - Full Time - Thurso, Highland","Thurso, Highland",Clyde Dental Practice Limited,5412101151,gumtree,"We are recruiting a full-time Associate Dentist to join our team at Dunbar Dental Clinic/Bridgend Healthcare Centre in Thurso. You will be an enthusiastic dentist, keen to work in a very busy, forward thinking NHS and private practice. You will have excellent resources in both staff and equipment with great opportunities for personal development also.  Caithness lies in an area of outstanding natural beauty with many outdoor pursuits available and the Dunbar Clinic and Bridgend Healthcare Centre is sited in the most northerly town in mainland UK.  Thurso is home to world champion surfing competitions and has many great walks and a wealth of archaeological sites. It has excellent schools; a very low crime rate and the people are friendly and welcoming.  What’s on offer with Clyde Munro Dental:  Dedicated Clinical Support team to help develop your career and grow your income Scotland’s only dedicated in-house training facility with phantom heads and lecture rooms for hands on and theoretical training. READ MORE HERE Complementary or subsidised training for Associates Clyde Munro Associate Conference held annually. Digital Dentistry, we are working towards being impression free by 2023 Excellent green credentials and commitment to reducing our environmental impact. Read more here Great clinical freedom and support. Fully trained team. A generous working pattern Excellent earning potential, CPD allowance Software of Excellence  About the practice:  This modern, fully equipped surgery practice offers NHS, private and cosmetic treatments including teeth whitening, hygiene treatment and dental implants and is a well led practice with a very stable supportive team.  General & Private dentistry Teeth whitening Implants Digital Scanner Airflow Patient care coordinator in practice to enhance patients journey  Who are we looking for?  Someone with the ambition to drive the expansion of the practice and provide a high level of clinical care Experience in General & Private dentistry/ Facial Aesthetics/ Composite bonding The ability to work well within a team. A passion for continuous professional development is essential. Experience of Software of Excellence (SOE) practice software is preferable. GDC registration and VT number are essential.  Overseas Applicants:  Clyde Munro welcomes applications from overseas dentists. Visa sponsorship and relocation support is available and will be discussed in detail with successful applicants to support each candidates’ specific requirements."," Job Position:Associate Dentist - Full Time - Thurso, Highland; Recruiter Company: Clyde Dental Practice Limited; Job Location:Thurso, Highland; Job Description: We are recruiting a full-time Associate Dentist to join our team at Dunbar Dental Clinic/Bridgend Healthcare Centre in Thurso. You will be an enthusiastic dentist, keen to work in a very busy, forward thinking NHS and private practice. You will have excellent resources in both staff and equipment with great opportunities for personal development also. Caithness lies in an area of outstanding natural beauty with many outdoor pursuits available and the Dunbar Clinic and Bridgend Healthcare Centre is sited in the most northerly town in mainland UK. Thurso is home to world champion surfing competitions and has many great walks and a wealth of archaeological sites. It has excellent schools; a very low crime rate and the people are friendly and welcoming. What’s on offer with Clyde Munro Dental: Dedicated Clinical Support team to help develop your career and grow your income Scotland’s only dedicated in-house training facility with phantom heads and lecture rooms for hands on and theoretical training. READ MORE HERE Complementary or subsidised training for Associates Clyde Munro Associate Conference held annually. Digital Dentistry, we are working towards being impression free by 2023 Excellent green credentials and commitment to reducing our environmental impact. Read more here Great clinical freedom and support. Fully trained team. A generous working pattern Excellent earning potential, CPD allowance Software of Excellence About the practice: This modern, fully equipped surgery practice offers NHS, private and cosmetic treatments including teeth whitening, hygiene treatment and dental implants and is a well led practice with a very stable supportive team. General & Private dentistry Teeth whitening Implants Digital Scanner Airflow Patient care coordinator in practice to enhance patients journey Who are we looking for? Someone with the ambition to drive the expansion of the practice and provide a high level of clinical care Experience in General & Private dentistry/ Facial Aesthetics/ Composite bonding The ability to work well within a team. A passion for continuous professional development is essential. Experience of Software of Excellence (SOE) practice software is preferable. GDC registration and VT number are essential. Overseas Applicants: Clyde Munro welcomes applications from overseas dentists. Visa sponsorship and relocation support is available and will be discussed in detail with successful applicants to support each candidates’ specific requirements.Job Source:gumtree",507
1050,AVON REPS-FULL OR PART TIME -IMMEDIATE START -ALL AREAS OF UK - WORK FROM HOME,"Bristol City Centre, Bristol",Avon cosmetics,5412033226,gumtree,"AVON REPS WANTED  Work from home around your current commitments  Perfect for stay-at-home mums and dads, students, or you in your spare time.  ** IMMEDIATE START **  No experience required  AVON REPRESENTATIVES  work from home sharing your digital link to products to get orders, and earn commission from the sales.  share digital brochure links to find customers online. using facebook and Instagram, whatsapp, etc.  Customers can shop online with you, and pay for their shopping online and Avon delivers the orders for you and you earn from those orders.  OR  Share brochures with friends and family to get orders.  Deliver door-to-door to find more customers  Sell on eBay or Amazon and other selling sites if you want to earn more  MORE SALES = MORE EARNINGS  TEAM LEADERS are required throughout the UK.  Recruit and train a team of representatives, whilst earning commissions and bonuses on your team sales  Work from home around your existing commitments, Full or Part Time  Full training given for both positions  Must be 18  and living in the UK  COMMISSION ONLY JOB  APPLY NOW FOR MORE INFO"," Job Position:AVON REPS-FULL OR PART TIME -IMMEDIATE START -ALL AREAS OF UK - WORK FROM HOME; Recruiter Company: Avon cosmetics; Job Location:Bristol City Centre, Bristol; Job Description: AVON REPS WANTED Work from home around your current commitments Perfect for stay-at-home mums and dads, students, or you in your spare time. ** IMMEDIATE START ** No experience required AVON REPRESENTATIVES work from home sharing your digital link to products to get orders, and earn commission from the sales. share digital brochure links to find customers online. using facebook and Instagram, whatsapp, etc. Customers can shop online with you, and pay for their shopping online and Avon delivers the orders for you and you earn from those orders. OR Share brochures with friends and family to get orders. Deliver door-to-door to find more customers Sell on eBay or Amazon and other selling sites if you want to earn more MORE SALES = MORE EARNINGS TEAM LEADERS are required throughout the UK. Recruit and train a team of representatives, whilst earning commissions and bonuses on your team sales Work from home around your existing commitments, Full or Part Time Full training given for both positions Must be 18 and living in the UK COMMISSION ONLY JOB APPLY NOW FOR MORE INFOJob Source:gumtree",289
1051,Live-Out Full Time Housekeeper,"Notting Hill, London",CHACE PEOPLE LIMITED,5412109666,gumtree,"LIVE OUT PERMANENT HOUSEKEEPER FOR VVIP FAMILY IN MAYFAIR - INTERVIEWS TAKING PLACE NOW!  Salary: £40,000k - £45,000 gross p.a. Location: Mayfair, London Interviews taking place now! Full-time | 5 days a week rotational schedule, 2 days off Permanent position  The Chace People team is actively searching for a brilliant Housekeeper to join a fully staffed household in Mayfair, London.  This is a fast-paced position where you will be joining a supportive team, with a Head Housekeeper, a Second Housekeeper and a House Manager already in place.  Ideally you will have superb Private Household experience and a clear understanding of how ultra-high net-worth households are run. Five-star hotel experience is much appreciated!  We are looking for a confident candidate with positive attitude who is highly detail oriented and with a great command of the English language. You shall be clear in your communication and will offer flexibility as required.  This is a full-time position where you will generally work 5 days a week, between 8-10h per day with Friday and Saturday as your usual days off, depending on the needs of the Principals.  You will be performing all usual Housekeeper duties one would expect of such a formal household, as well as intricate laundry care and ironing.  If this sounds like the right role for you, then please do get in touch, we'd love to hear from you!  Please note that candidates with relevant experience and excellent, checkable references need only apply."," Job Position:Live-Out Full Time Housekeeper; Recruiter Company: CHACE PEOPLE LIMITED; Job Location:Notting Hill, London; Job Description: LIVE OUT PERMANENT HOUSEKEEPER FOR VVIP FAMILY IN MAYFAIR - INTERVIEWS TAKING PLACE NOW! Salary: £40,000k - £45,000 gross p.a. Location: Mayfair, London Interviews taking place now! Full-time | 5 days a week rotational schedule, 2 days off Permanent position The Chace People team is actively searching for a brilliant Housekeeper to join a fully staffed household in Mayfair, London. This is a fast-paced position where you will be joining a supportive team, with a Head Housekeeper, a Second Housekeeper and a House Manager already in place. Ideally you will have superb Private Household experience and a clear understanding of how ultra-high net-worth households are run. Five-star hotel experience is much appreciated! We are looking for a confident candidate with positive attitude who is highly detail oriented and with a great command of the English language. You shall be clear in your communication and will offer flexibility as required. This is a full-time position where you will generally work 5 days a week, between 8-10h per day with Friday and Saturday as your usual days off, depending on the needs of the Principals. You will be performing all usual Housekeeper duties one would expect of such a formal household, as well as intricate laundry care and ironing. If this sounds like the right role for you, then please do get in touch, we'd love to hear from you! Please note that candidates with relevant experience and excellent, checkable references need only apply.Job Source:gumtree",359
1052,Skilled Landscaper Needed ASAP - Wembley,"Wembley, London",LANDCRAFT LTD,5412121279,gumtree,"Landscaper  We are looking for a skilled landscaper to join our small, dedicated and friendly team. We believe in working hard but also having fun through the day.  Landcraft is London's leading landscape garden design company. We design and install high-end bespoke gardens. We’ve won multiple awards at Grand Designs Live, the RHS Hampton Court Palace Flower Show and other industry-leading events.  Responsibilities:  Lay paving stone Laying brick walls Ground works such as preparation for patios and walls The ability to work without the need for supervision  Requirements:  3  years’ experience (5  years preferred) Ability to work outdoors in all weather conditions Must be located in Wembley area to enable pick up/drop off to work locations in central London.  · Licence (preferred)  · Knowledge and experience in installing a variety of hardscape applications  Highly motivated, self-driven and detail orientated Excellent attention to detail Able to work effectively in a fun fast-paced environment Clean and professional appearance Punctual and dependable  Start date: ASAP  You would be working in private gardens in and around your local area. Our installations are typically contemporary gardens. A large percentage of our installations require hard landscaping.  We believe our workforce is our family, so having a close knit team and a fun environment is key to the success of our projects.  Salary : £130 per day"," Job Position:Skilled Landscaper Needed ASAP - Wembley; Recruiter Company: LANDCRAFT LTD; Job Location:Wembley, London; Job Description: Landscaper We are looking for a skilled landscaper to join our small, dedicated and friendly team. We believe in working hard but also having fun through the day. Landcraft is London's leading landscape garden design company. We design and install high-end bespoke gardens. We’ve won multiple awards at Grand Designs Live, the RHS Hampton Court Palace Flower Show and other industry-leading events. Responsibilities: Lay paving stone Laying brick walls Ground works such as preparation for patios and walls The ability to work without the need for supervision Requirements: 3 years’ experience (5 years preferred) Ability to work outdoors in all weather conditions Must be located in Wembley area to enable pick up/drop off to work locations in central London. · Licence (preferred) · Knowledge and experience in installing a variety of hardscape applications Highly motivated, self-driven and detail orientated Excellent attention to detail Able to work effectively in a fun fast-paced environment Clean and professional appearance Punctual and dependable Start date: ASAP You would be working in private gardens in and around your local area. Our installations are typically contemporary gardens. A large percentage of our installations require hard landscaping. We believe our workforce is our family, so having a close knit team and a fun environment is key to the success of our projects. Salary : £130 per dayJob Source:gumtree",318
1053,Bricklayers and hod carrier required,"Manningtree, Essex",No recuriter details,5412122875,gumtree,"Bricklayers required, long run of work, day work only, starting at £220 and see where we end up  hod carriers £150  CSCS cards needed  Call Gary on 07488373444"," Job Position:Bricklayers and hod carrier required; Recruiter Company: No recuriter details; Job Location:Manningtree, Essex; Job Description: Bricklayers required, long run of work, day work only, starting at £220 and see where we end up hod carriers £150 CSCS cards needed Call Gary on 07488373444Job Source:gumtree",83
1054,Hod carriers / labour wanted,"Poole, Dorset",No recuriter details,5412119168,gumtree,Hard working Hod carriers/ labour that drive long run of local works poole and Bournemouth area £14-£18ph call 07854038788," Job Position:Hod carriers / labour wanted; Recruiter Company: No recuriter details; Job Location:Poole, Dorset; Job Description: Hard working Hod carriers/ labour that drive long run of local works poole and Bournemouth area £14-£18ph call 07854038788Job Source:gumtree",72
1055,Housekeeper,"Westminster, London",CHACE PEOPLE LIMITED,5412102232,gumtree,"LIVE-OUT HOUSEKEEPER POSITION FOR PROFESSIONAL HIGH-NET WORTH FAMILY IN MARYLEBONE  £45,000 - £50,000  gross p.a. (DOE) Marylebone, London Interviewing now! Live Out | Easy transport links or local candidates desired Approx. 45-50h per week with flexibility | Monday to Friday working week  The Chace People team is searching for a highly organised Housekeeper, who will bring a wealth of private household experience, for a lovely, young professional family of four living in Marylebone, London.  This is a 5-storey Georgian Townhouse with an existing household team in place consisting a Family PA and Nanny who you will be working alongside. As the ideal candidate you will be experienced and confident as a Sole Housekeeper, bringing nutritious family cooking skills, a child friendly attitude, 5* standards and an attention to detail mind-set with you.  Your duties will include (but not limited to):  All high-level housekeeping, cleaning and organisation of the home Laundry for the entire family, including ironing, care of fine fabrics and dry-cleaning errands Wardrobe maintenance and knowledge of dealing with delicate materials Packing and unpacking when the family travels Making a list of groceries and other household supplies that are required and which need replenishing; provisioning online and through errands Cooking family meals (simple, nutritious family dishes and following recipes) Receiving deliveries and running errands when needed Liaising with the household team and outside contractors to ensure the smooth running of the property Any other household tasks which are assigned to you - TBD at interview stage    As the ideal Housekeeper you will:  Have previous experience of working as a Sole Housekeeper in a large, busy private family household Have high levels of organisation and experience working unsupervised Understand professional boundaries and be respectful of privacy Be fast on your feet, with a positive energy and able to prioritise your tasks Value discretion with a friendly personality and be a team player  If this sounds like the right role for you, then please do get in touch, we'd love to hear from you and our client is interviewing now!  Please note that candidates with relevant experience and excellent, checkable references need only apply."," Job Position:Housekeeper; Recruiter Company: CHACE PEOPLE LIMITED; Job Location:Westminster, London; Job Description: LIVE-OUT HOUSEKEEPER POSITION FOR PROFESSIONAL HIGH-NET WORTH FAMILY IN MARYLEBONE £45,000 - £50,000 gross p.a. (DOE) Marylebone, London Interviewing now! Live Out | Easy transport links or local candidates desired Approx. 45-50h per week with flexibility | Monday to Friday working week The Chace People team is searching for a highly organised Housekeeper, who will bring a wealth of private household experience, for a lovely, young professional family of four living in Marylebone, London. This is a 5-storey Georgian Townhouse with an existing household team in place consisting a Family PA and Nanny who you will be working alongside. As the ideal candidate you will be experienced and confident as a Sole Housekeeper, bringing nutritious family cooking skills, a child friendly attitude, 5* standards and an attention to detail mind-set with you. Your duties will include (but not limited to): All high-level housekeeping, cleaning and organisation of the home Laundry for the entire family, including ironing, care of fine fabrics and dry-cleaning errands Wardrobe maintenance and knowledge of dealing with delicate materials Packing and unpacking when the family travels Making a list of groceries and other household supplies that are required and which need replenishing; provisioning online and through errands Cooking family meals (simple, nutritious family dishes and following recipes) Receiving deliveries and running errands when needed Liaising with the household team and outside contractors to ensure the smooth running of the property Any other household tasks which are assigned to you - TBD at interview stage As the ideal Housekeeper you will: Have previous experience of working as a Sole Housekeeper in a large, busy private family household Have high levels of organisation and experience working unsupervised Understand professional boundaries and be respectful of privacy Be fast on your feet, with a positive energy and able to prioritise your tasks Value discretion with a friendly personality and be a team player If this sounds like the right role for you, then please do get in touch, we'd love to hear from you and our client is interviewing now! Please note that candidates with relevant experience and excellent, checkable references need only apply.Job Source:gumtree",491
1056,"LIVE-OUT HEAD HOUSEKEEPER POSITION FOR VVIP HOUSEHOLD IN MAYFAIR, LONDON","Kensington, London",CHACE PEOPLE LIMITED,5412109558,gumtree,"LIVE-OUT HEAD HOUSEKEEPER POSITION FOR VVIP HOUSEHOLD IN MAYFAIR, LONDON  Salary: £50,000 - £55,000 gross p.a. (DOE) Location: Belgravia, London Permanent Contract Live out | Monday to Friday position  The Chace People team is looking for an outstanding, driven and professional Head Housekeeper to join our VVIP client in Mayfair, London.  This is a live-out position and requires a confident and experienced Housekeeper who would be able to lead her team of 2 Housekeepers in place already. This is a fully staffed household with a House Manager and a Chef on the property. Generally, your work week will be from Monday to Friday, however flexibility is required.  Duties as Head Housekeeper will include (but will not be limited to):  Managing a team of 2 Housekeepers Organising the schedules and rotation Liaising with the suppliers and making sure everything is always stocked All duties associated with high-level housekeeping Receiving deliveries and organising pickups  As the ideal Housekeeper you will:  Have previous experience working as a private Head Housekeeper Have extremely high levels of organisation and running a team Have a sunny disposition and be solution orientated Be driven and take everything as a challenge Willingness to go above and beyond to make sure the team is working as one Understand professional boundaries and be respectful of privacy Value discretion  This would be a great role for luxury hospitality professionals looking to step into private households or a seasoned Head Housekeeper who is up for the next challenge. Interviews are taking place now and if this sounds like the right role for you, then please do get in touch, we'd love to hear from you!  Please note that candidates with relevant experience and excellent, checkable references need only apply."," Job Position:LIVE-OUT HEAD HOUSEKEEPER POSITION FOR VVIP HOUSEHOLD IN MAYFAIR, LONDON; Recruiter Company: CHACE PEOPLE LIMITED; Job Location:Kensington, London; Job Description: LIVE-OUT HEAD HOUSEKEEPER POSITION FOR VVIP HOUSEHOLD IN MAYFAIR, LONDON Salary: £50,000 - £55,000 gross p.a. (DOE) Location: Belgravia, London Permanent Contract Live out | Monday to Friday position The Chace People team is looking for an outstanding, driven and professional Head Housekeeper to join our VVIP client in Mayfair, London. This is a live-out position and requires a confident and experienced Housekeeper who would be able to lead her team of 2 Housekeepers in place already. This is a fully staffed household with a House Manager and a Chef on the property. Generally, your work week will be from Monday to Friday, however flexibility is required. Duties as Head Housekeeper will include (but will not be limited to): Managing a team of 2 Housekeepers Organising the schedules and rotation Liaising with the suppliers and making sure everything is always stocked All duties associated with high-level housekeeping Receiving deliveries and organising pickups As the ideal Housekeeper you will: Have previous experience working as a private Head Housekeeper Have extremely high levels of organisation and running a team Have a sunny disposition and be solution orientated Be driven and take everything as a challenge Willingness to go above and beyond to make sure the team is working as one Understand professional boundaries and be respectful of privacy Value discretion This would be a great role for luxury hospitality professionals looking to step into private households or a seasoned Head Housekeeper who is up for the next challenge. Interviews are taking place now and if this sounds like the right role for you, then please do get in touch, we'd love to hear from you! Please note that candidates with relevant experience and excellent, checkable references need only apply.Job Source:gumtree",419
1057,DECORATORS REQUIRED - IMMEDIATE START - LOTS OF WORK AVAILABLE - LONDON AREAS,"Central London, London",House Line Building Services,5412058189,gumtree,DECORATORS REQUIRED FOR IMMEDIATE START - ALL LONDON AREAS  We are a Construction & Maintenance company established for 30 years.  Competitive wage - £150-£250 per day (depending on experience)  Applicants must be;  Reliable Good communication skills Have a good attitude Own tools Own vehicle CSCS Card  PLEASE CONTACT: 01707-270008  OR  EMAIL: ps@hlbs.co," Job Position:DECORATORS REQUIRED - IMMEDIATE START - LOTS OF WORK AVAILABLE - LONDON AREAS; Recruiter Company: House Line Building Services; Job Location:Central London, London; Job Description: DECORATORS REQUIRED FOR IMMEDIATE START - ALL LONDON AREAS We are a Construction & Maintenance company established for 30 years. Competitive wage - £150-£250 per day (depending on experience) Applicants must be; Reliable Good communication skills Have a good attitude Own tools Own vehicle CSCS Card PLEASE CONTACT: 01707-270008 OR EMAIL: ps@hlbs.coJob Source:gumtree",147
