,position,location,Recruiter,Ad_id,job_source,Details,text,n_tokens
1000,BUCKINGHAMSHIRE -LIVE IN - COUPLE OR SINGLE LADY - HK/COOK/DRIVER/OUTDOOR DUTIES/DOG FRIENDLY,"Buckingham, Buckinghamshire",The Graham Agency,5412070110,gumtree,"PROFESSIONAL, BUSY FAMILY WITH ONE YOUNG ADULT STUDYING AND 3 DOGS REQUIRE EITHER  ONE EXPERIENCED HOUSEKEEPER/DRIVER/DINNER PARTY COOK TO BE RESPONSIBLE FOR THE DAY TO DAY RUNNING OF THE HOME TO INCLUDE,LAUNDRY/IRONING/RUNNING ERRANDS/SHOPPING/COOKING OR  A COUPLE- HOUSEKEEPING DUTIES AS ABOVE - PARTNER WILL BE RESPONSIBLE FOR ALL EXTERNAL DUTIES, TO INCLUDE SOME GARDENING/DRIVING/MAINTAINING THE CARS TO A CLEAN STANDARD /LIAISE WITH TRADES PERSONS/CONTRACTORS  THIS IS A 5 DAY WEEK POSITION (WEEKENDS FULLY FLEXIBLE)  SUPER ACCOMMODATION : OWN ENTRANCE/FULLY SELF CONTAINED  GOOD ENGLISH/LONG TERM REFERENCES AND C.V.  TO START AS SOON AS CANDIDATE (S) SOURCED"," Job Position:BUCKINGHAMSHIRE -LIVE IN - COUPLE OR SINGLE LADY - HK/COOK/DRIVER/OUTDOOR DUTIES/DOG FRIENDLY; Recruiter Company: The Graham Agency; Job Location:Buckingham, Buckinghamshire; Job Description: PROFESSIONAL, BUSY FAMILY WITH ONE YOUNG ADULT STUDYING AND 3 DOGS REQUIRE EITHER ONE EXPERIENCED HOUSEKEEPER/DRIVER/DINNER PARTY COOK TO BE RESPONSIBLE FOR THE DAY TO DAY RUNNING OF THE HOME TO INCLUDE,LAUNDRY/IRONING/RUNNING ERRANDS/SHOPPING/COOKING OR A COUPLE- HOUSEKEEPING DUTIES AS ABOVE - PARTNER WILL BE RESPONSIBLE FOR ALL EXTERNAL DUTIES, TO INCLUDE SOME GARDENING/DRIVING/MAINTAINING THE CARS TO A CLEAN STANDARD /LIAISE WITH TRADES PERSONS/CONTRACTORS THIS IS A 5 DAY WEEK POSITION (WEEKENDS FULLY FLEXIBLE) SUPER ACCOMMODATION : OWN ENTRANCE/FULLY SELF CONTAINED GOOD ENGLISH/LONG TERM REFERENCES AND C.V. TO START AS SOON AS CANDIDATE (S) SOURCEDJob Source:gumtree",319
1001,Event Rigger - Exhibitions/ Festivals (van driver),"Northampton, Northamptonshire",No recuriter details,5412107513,gumtree,"We are seeking a van driver/rigger.  We have a full time position available in our logistics and operations team. You would need to be able to drive a van and be capable of setting up and breaking down exhibitions and events.  The role includes working weekends, generally Thursday - Monday, Saturdays and Sundays are considered working days every week (except when booked as holiday). However, we will require some flexibility with regards to these days as events can differ week to week.  The ideal candidate would be able to use initiative, be proactive as well as an active problem solver with a keen eye for detail and able to demonstrate a good level of competancy.  As an agency, we attend a variety of exhibitions and events across the country on behalf of our clients HelloFresh, Bella & Duke and Abel & Cole. As we are representing a variety of Brands we need someone who has a good level of brand awareness, able to follow instructions accurately and have consideration for Health & Safety at all times.  The role requires regular visits to our warehouse for loading and unloading, traveling nationwide to a variety of different events for loading, unloading, build and breakdown of stands, good common sense and for care to be taken at all times when handling inventory.  Having your own Van would be advantageous, and at a higher hourly rate with a fuel card provided. Although, it is not necessary for the right candidate. The majority of events are between London and Birmingham, however as the summer approaches we will be venturing to more locations throughout the UK (90%  of which will be within England.) Our storage facility is close to Northampton, so we would be looking for someone relatively close to here."," Job Position:Event Rigger - Exhibitions/ Festivals (van driver); Recruiter Company: No recuriter details; Job Location:Northampton, Northamptonshire; Job Description: We are seeking a van driver/rigger. We have a full time position available in our logistics and operations team. You would need to be able to drive a van and be capable of setting up and breaking down exhibitions and events. The role includes working weekends, generally Thursday - Monday, Saturdays and Sundays are considered working days every week (except when booked as holiday). However, we will require some flexibility with regards to these days as events can differ week to week. The ideal candidate would be able to use initiative, be proactive as well as an active problem solver with a keen eye for detail and able to demonstrate a good level of competancy. As an agency, we attend a variety of exhibitions and events across the country on behalf of our clients HelloFresh, Bella & Duke and Abel & Cole. As we are representing a variety of Brands we need someone who has a good level of brand awareness, able to follow instructions accurately and have consideration for Health & Safety at all times. The role requires regular visits to our warehouse for loading and unloading, traveling nationwide to a variety of different events for loading, unloading, build and breakdown of stands, good common sense and for care to be taken at all times when handling inventory. Having your own Van would be advantageous, and at a higher hourly rate with a fuel card provided. Although, it is not necessary for the right candidate. The majority of events are between London and Birmingham, however as the summer approaches we will be venturing to more locations throughout the UK (90% of which will be within England.) Our storage facility is close to Northampton, so we would be looking for someone relatively close to here.Job Source:gumtree",385
1002,Business Development Manager (Part Time-Field Job),United Kingdom,No recuriter details,5412123273,gumtree,"Company Overview:  We are a leading company based in the USA, specializing in partnering and venturing with companies across various industries. With our expertise in establishing joint ventures and partnerships, we aim to facilitate the growth and expansion of businesses in the United States. We are now expanding our operations to the UK and seeking a skilled and dynamic individual to join our team as a Business Development Manager.  Position: Business Development Manager  Location: United Kingdom  Job Responsibilities: As a Business Development Manager, your primary role will be to identify potential business owners and manufacturers in the UK who are interested in joint ventures with companies based in the USA. You will play a crucial role in building strategic partnerships and facilitating business growth opportunities.  Your key responsibilities will include:  1. Meeting and identifying potential clients in the UK who are suitable for joint ventures with USA companies. (Leads will be provided)  2. Conducting market analysis to understand industry trends and identifying potential business opportunities.  3. Contacting and visiting potential clients to present our partnership opportunities and negotiate favourable agreements.  4. Building strong relationships with key decision-makers and stakeholders.  5. Collaborating with internal teams to ensure a smooth transition from prospecting to partnership implementation.  6. Providing regular updates and reports on market trends, competitive analysis, and potential leads.  7. Attending industry events, conferences, and trade shows to represent the company and network with potential partners.  8. Meeting and exceeding assigned targets and objectives.  Requirements: To excel in this role, the following qualifications and skills are required:  1. Strong communication, negotiation, and interpersonal skills.  2. Exceptional networking abilities with a demonstrated track record of building successful business relationships.  3. Self-motivated and target-driven individual with the ability to work independently and as part of a team.  4. Willingness to travel within the UK and potentially nearby areas as required.  5. Valid driving license and access to a vehicle for travel purposes.  6. Excellent organizational and time management skills.  7. Knowledge of relevant industries and market dynamics.  8. Ability to analyse market trends and identify potential business opportunities.  9. Flexibility to adapt to changing business needs and priorities.  Remuneration:  We offer a competitive remuneration package, consisting of a negotiable fixed basic salary, commissions based on achieved targets, and a travel allowance to cover travel expenses. The overall compensation will be commensurate with your qualifications, skills, and experience.  If you are an ambitious, results-driven individual with a passion for business development and partnership building, we invite you to join our team and contribute to the growth of our organization.  How to Apply:  Interested candidates are requested to submit onsite form and their resumes detailing their relevant experience (if any) and qualifications.  We appreciate all applications; however, only shortlisted candidates will be contacted for further evaluation. Thank you for your interest in our company."," Job Position:Business Development Manager (Part Time-Field Job); Recruiter Company: No recuriter details; Job Location:United Kingdom; Job Description: Company Overview: We are a leading company based in the USA, specializing in partnering and venturing with companies across various industries. With our expertise in establishing joint ventures and partnerships, we aim to facilitate the growth and expansion of businesses in the United States. We are now expanding our operations to the UK and seeking a skilled and dynamic individual to join our team as a Business Development Manager. Position: Business Development Manager Location: United Kingdom Job Responsibilities: As a Business Development Manager, your primary role will be to identify potential business owners and manufacturers in the UK who are interested in joint ventures with companies based in the USA. You will play a crucial role in building strategic partnerships and facilitating business growth opportunities. Your key responsibilities will include: 1. Meeting and identifying potential clients in the UK who are suitable for joint ventures with USA companies. (Leads will be provided) 2. Conducting market analysis to understand industry trends and identifying potential business opportunities. 3. Contacting and visiting potential clients to present our partnership opportunities and negotiate favourable agreements. 4. Building strong relationships with key decision-makers and stakeholders. 5. Collaborating with internal teams to ensure a smooth transition from prospecting to partnership implementation. 6. Providing regular updates and reports on market trends, competitive analysis, and potential leads. 7. Attending industry events, conferences, and trade shows to represent the company and network with potential partners. 8. Meeting and exceeding assigned targets and objectives. Requirements: To excel in this role, the following qualifications and skills are required: 1. Strong communication, negotiation, and interpersonal skills. 2. Exceptional networking abilities with a demonstrated track record of building successful business relationships. 3. Self-motivated and target-driven individual with the ability to work independently and as part of a team. 4. Willingness to travel within the UK and potentially nearby areas as required. 5. Valid driving license and access to a vehicle for travel purposes. 6. Excellent organizational and time management skills. 7. Knowledge of relevant industries and market dynamics. 8. Ability to analyse market trends and identify potential business opportunities. 9. Flexibility to adapt to changing business needs and priorities. Remuneration: We offer a competitive remuneration package, consisting of a negotiable fixed basic salary, commissions based on achieved targets, and a travel allowance to cover travel expenses. The overall compensation will be commensurate with your qualifications, skills, and experience. If you are an ambitious, results-driven individual with a passion for business development and partnership building, we invite you to join our team and contribute to the growth of our organization. How to Apply: Interested candidates are requested to submit onsite form and their resumes detailing their relevant experience (if any) and qualifications. We appreciate all applications; however, only shortlisted candidates will be contacted for further evaluation. Thank you for your interest in our company.Job Source:gumtree",618
1003,Maintenance Engineer / Multi Trader / Highly Skilled,"Clapham Common, London",No recuriter details,5412121773,gumtree,"TITLE: Maintenance Engineer / Multi Trader / Highly Skilled  LOCATION: SW4 6DH, London, United Kingdom  TERMS: Self-employed  SALARY: £36,000 - £45,500 / £150 - £190 Per Day / All Expenses Paid  BENEFITS:  Parking & Petrol Paid For  Company Card For Materials  Brand New Van  Career Progression  Recognition For Excellence  Join a Growing Business  ABOUT US:  Optimal Maintenance Ltd offers property maintenance to a variety of clients from property management companies to high-end estate agents.  Optimal Maintenance Ltd offers a professional service covering all types of property maintenance. This could be a carpenter to fit a new door lock, a gas-safe plumber to install a new boiler , or a full property refurbishment. No job is too small and, as a result, this means properties receive the care they deserve with a high level of customer service from both office and field staff.  THE ROLE:  We are looking to expand our team and are seeking to recruit a dynamic Multi-Trader who takes pride in their work to join our team.  The successful candidate will be responsible for carrying out property repairs, maintenance tasks, and property inspections. You will deliver exceptional customer service and support the Maintenance team.  KEY TASK & RESPONSIBILITIES:  Visiting properties to diagnose and carry out repairs as per the schedule arranged for that day  Carry out plumbing (e.g., unblocking drains/gutters, fixing leaks, and changing taps/waste)  Carry out electrics (e.g., changing bulbs/fittings, replacing switches or sockets)  Carry out carpentry (e.g., changing locks, handles, door replacements)  Carry out patch plaster and basic painting and decorations  Carry out basic handyman services (e.g., installation of blinds)  Carry out full refurbishments (new kitchens/bathroom)  Travel between jobs in and around London  Update jobs via app portal ensuring reports are written thoroughly and good quality before and after pictures are taken  Where jobs are to be quoted for to provide a report and links with the materials needed, and time needed to carry out the further repairs along with a description of the issue and the timing needed to rectify the issue  Working hours will be either be 8am-5pm or 9am-6pm  Thorough knowledge of local DIY stores in London  THE IDEAL CANDIDATE SHOULD HAVE:  Multi–skilled within the construction trade  Ability to carry out basic electrical duties/installations, basic plumbing work and basic carpentry and joinery  Must have their own tools  Clean valid UK driving license and must be over 25 years old due to insurance  Trustworthy with excellent quality workmanship  Ability to diagnose and carry out repairs whilst on site including the ability to source materials required  Good verbal and written communication skills  For more information, please visit our website at www.theoptimalgroup.co.uk or send an email to jobs@theoptimalgroup.co.uk or call us 0208 004 4442  Please send your C.V to jobs@theoptimalgroup.co.uk Immediate start"," Job Position:Maintenance Engineer / Multi Trader / Highly Skilled; Recruiter Company: No recuriter details; Job Location:Clapham Common, London; Job Description: TITLE: Maintenance Engineer / Multi Trader / Highly Skilled LOCATION: SW4 6DH, London, United Kingdom TERMS: Self-employed SALARY: £36,000 - £45,500 / £150 - £190 Per Day / All Expenses Paid BENEFITS: Parking & Petrol Paid For Company Card For Materials Brand New Van Career Progression Recognition For Excellence Join a Growing Business ABOUT US: Optimal Maintenance Ltd offers property maintenance to a variety of clients from property management companies to high-end estate agents. Optimal Maintenance Ltd offers a professional service covering all types of property maintenance. This could be a carpenter to fit a new door lock, a gas-safe plumber to install a new boiler , or a full property refurbishment. No job is too small and, as a result, this means properties receive the care they deserve with a high level of customer service from both office and field staff. THE ROLE: We are looking to expand our team and are seeking to recruit a dynamic Multi-Trader who takes pride in their work to join our team. The successful candidate will be responsible for carrying out property repairs, maintenance tasks, and property inspections. You will deliver exceptional customer service and support the Maintenance team. KEY TASK & RESPONSIBILITIES: Visiting properties to diagnose and carry out repairs as per the schedule arranged for that day Carry out plumbing (e.g., unblocking drains/gutters, fixing leaks, and changing taps/waste) Carry out electrics (e.g., changing bulbs/fittings, replacing switches or sockets) Carry out carpentry (e.g., changing locks, handles, door replacements) Carry out patch plaster and basic painting and decorations Carry out basic handyman services (e.g., installation of blinds) Carry out full refurbishments (new kitchens/bathroom) Travel between jobs in and around London Update jobs via app portal ensuring reports are written thoroughly and good quality before and after pictures are taken Where jobs are to be quoted for to provide a report and links with the materials needed, and time needed to carry out the further repairs along with a description of the issue and the timing needed to rectify the issue Working hours will be either be 8am-5pm or 9am-6pm Thorough knowledge of local DIY stores in London THE IDEAL CANDIDATE SHOULD HAVE: Multi–skilled within the construction trade Ability to carry out basic electrical duties/installations, basic plumbing work and basic carpentry and joinery Must have their own tools Clean valid UK driving license and must be over 25 years old due to insurance Trustworthy with excellent quality workmanship Ability to diagnose and carry out repairs whilst on site including the ability to source materials required Good verbal and written communication skills For more information, please visit our website at www.theoptimalgroup.co.uk or send an email to jobs@theoptimalgroup.co.uk or call us 0208 004 4442 Please send your C.V to jobs@theoptimalgroup.co.uk Immediate startJob Source:gumtree",671
1004,"Associate Dentist (Maternity Cover) - North Ayrshire, 30 minutes from Glasgow","Stevenston, North Ayrshire",Clyde Dental Practice Limited,5412047263,gumtree,"We are recruiting a part-time Associate Dentist to join our team at Three Towns Stevenston Dental Care. This will be on a fixed term contract basis to cover maternity leave from July 2023, a permanent opportunity may follow. You will be working Monday, Tuesday and Thursday in a two surgery practice located in the centre of town with free parking available.  What’s on offer with Clyde Munro Dental:  Dedicated Clinical Support team to help develop your career and grow your income Scotland’s only dedicated in-house training facility with phantom heads and lecture rooms for hands on and theoretical training. READ MORE HERE Complementary or subsidised training for Associates Clyde Munro Associate Conference held annually. Digital Dentistry Excellent green credentials and commitment to reducing our environmental impact. Read more here Great clinical freedom and support. Fully trained team. A generous working pattern Excellent earning potential Software of Excellence  About the practice:  This modern, fully equipped surgery provide a full range of both NHS and private dental treatments including general dentistry, orthodontics, dental implants, oral surgery, cosmetic dentistry and facial aesthetics.  Who are we looking for?  Experience in General & Private dentistry/ Facial Aesthetics The ability to work well within a team. A passion for continuous professional development is essential. Experience of Software of Excellence (SOE) practice software is preferable. GDC registration is essential.  Overseas Applicants:  Clyde Munro welcomes applications from overseas dentists. Visa sponsorship and relocation support is available and will be discussed in detail with successful applicants to support each candidates’ specific requirements."," Job Position:Associate Dentist (Maternity Cover) - North Ayrshire, 30 minutes from Glasgow; Recruiter Company: Clyde Dental Practice Limited; Job Location:Stevenston, North Ayrshire; Job Description: We are recruiting a part-time Associate Dentist to join our team at Three Towns Stevenston Dental Care. This will be on a fixed term contract basis to cover maternity leave from July 2023, a permanent opportunity may follow. You will be working Monday, Tuesday and Thursday in a two surgery practice located in the centre of town with free parking available. What’s on offer with Clyde Munro Dental: Dedicated Clinical Support team to help develop your career and grow your income Scotland’s only dedicated in-house training facility with phantom heads and lecture rooms for hands on and theoretical training. READ MORE HERE Complementary or subsidised training for Associates Clyde Munro Associate Conference held annually. Digital Dentistry Excellent green credentials and commitment to reducing our environmental impact. Read more here Great clinical freedom and support. Fully trained team. A generous working pattern Excellent earning potential Software of Excellence About the practice: This modern, fully equipped surgery provide a full range of both NHS and private dental treatments including general dentistry, orthodontics, dental implants, oral surgery, cosmetic dentistry and facial aesthetics. Who are we looking for? Experience in General & Private dentistry/ Facial Aesthetics The ability to work well within a team. A passion for continuous professional development is essential. Experience of Software of Excellence (SOE) practice software is preferable. GDC registration is essential. Overseas Applicants: Clyde Munro welcomes applications from overseas dentists. Visa sponsorship and relocation support is available and will be discussed in detail with successful applicants to support each candidates’ specific requirements.Job Source:gumtree",375
